{
 "schema": 1,
 "phenomenonId": "weather.temperature_anomaly",
 "eventId": null,
 "time": {
  "observedAt": "2026-09-20T01:00:00+09:00",
  "retrievedAt": "2026-09-19T18:30:00Z"
 },
 "current": {
  "values": [
   {
    "key": "temp_108",
    "value": 21.6,
    "unit": "°C",
    "kind": "OFFICIAL_OBSERVATION",
    "source": "기상청 ASOS 정시 관측 (API허브 kma_sfctm3)",
    "at": "2026-09-20T01:00:00+09:00",
    "stationId": "108",
    "labelKo": "서울 기온(지금)",
    "labelEn": "Seoul temperature (now)"
   },
   {
    "key": "temp_159",
    "value": 21.2,
    "unit": "°C",
    "kind": "OFFICIAL_OBSERVATION",
    "source": "기상청 ASOS 정시 관측 (API허브 kma_sfctm3)",
    "at": "2026-09-20T01:00:00+09:00",
    "stationId": "159",
    "labelKo": "부산 기온(지금)",
    "labelEn": "Busan temperature (now)"
   },
   {
    "key": "temp_152",
    "value": 19.7,
    "unit": "°C",
    "kind": "OFFICIAL_OBSERVATION",
    "source": "기상청 ASOS 정시 관측 (API허브 kma_sfctm3)",
    "at": "2026-09-20T01:00:00+09:00",
    "stationId": "152",
    "labelKo": "울산 기온(지금)",
    "labelEn": "Ulsan temperature (now)"
   },
   {
    "key": "temp_156",
    "value": 22.1,
    "unit": "°C",
    "kind": "OFFICIAL_OBSERVATION",
    "source": "기상청 ASOS 정시 관측 (API허브 kma_sfctm3)",
    "at": "2026-09-20T01:00:00+09:00",
    "stationId": "156",
    "labelKo": "광주 기온(지금)",
    "labelEn": "Gwangju temperature (now)"
   },
   {
    "key": "temp_133",
    "value": 20.5,
    "unit": "°C",
    "kind": "OFFICIAL_OBSERVATION",
    "source": "기상청 ASOS 정시 관측 (API허브 kma_sfctm3)",
    "at": "2026-09-20T01:00:00+09:00",
    "stationId": "133",
    "labelKo": "대전 기온(지금)",
    "labelEn": "Daejeon temperature (now)"
   },
   {
    "key": "temp_105",
    "value": 17.8,
    "unit": "°C",
    "kind": "OFFICIAL_OBSERVATION",
    "source": "기상청 ASOS 정시 관측 (API허브 kma_sfctm3)",
    "at": "2026-09-20T01:00:00+09:00",
    "stationId": "105",
    "labelKo": "강릉 기온(지금)",
    "labelEn": "Gangneung temperature (now)"
   },
   {
    "key": "temp_184",
    "value": 23.1,
    "unit": "°C",
    "kind": "OFFICIAL_OBSERVATION",
    "source": "기상청 ASOS 정시 관측 (API허브 kma_sfctm3)",
    "at": "2026-09-20T01:00:00+09:00",
    "stationId": "184",
    "labelKo": "제주 기온(지금)",
    "labelEn": "Jeju temperature (now)"
   }
  ]
 },
 "anomaly": {
  "baseline": {
   "name": "기상청 평년값 — 일평균기온 (09월 19일)",
   "source": "기상청 API허브 sfc_norm1 (tmst=2021)",
   "period": "1991-2020"
  },
  "items": [
   {
    "key": "dailyMean_108",
    "value": 23.9,
    "baseline": 21.0,
    "delta": 2.9,
    "unit": "°C",
    "kind": "EARTHUS_ANALYSIS",
    "source": "기상청 ASOS 정시 관측의 하루 평균 − 기상청 1991–2020 평년 평균기온 (같은 지점)",
    "at": "2026-09-19",
    "stationId": "108",
    "method": "24회 정시 관측 평균",
    "samples": 24,
    "labelKo": "서울 어제 하루 평균",
    "labelEn": "Seoul yesterday's daily mean"
   },
   {
    "key": "dailyMean_159",
    "value": 23.5,
    "baseline": 22.2,
    "delta": 1.3,
    "unit": "°C",
    "kind": "EARTHUS_ANALYSIS",
    "source": "기상청 ASOS 정시 관측의 하루 평균 − 기상청 1991–2020 평년 평균기온 (같은 지점)",
    "at": "2026-09-19",
    "stationId": "159",
    "method": "24회 정시 관측 평균",
    "samples": 24,
    "labelKo": "부산 어제 하루 평균",
    "labelEn": "Busan yesterday's daily mean"
   },
   {
    "key": "dailyMean_152",
    "value": 22.2,
    "baseline": 21.3,
    "delta": 0.9,
    "unit": "°C",
    "kind": "EARTHUS_ANALYSIS",
    "source": "기상청 ASOS 정시 관측의 하루 평균 − 기상청 1991–2020 평년 평균기온 (같은 지점)",
    "at": "2026-09-19",
    "stationId": "152",
    "method": "24회 정시 관측 평균",
    "samples": 24,
    "labelKo": "울산 어제 하루 평균",
    "labelEn": "Ulsan yesterday's daily mean"
   },
   {
    "key": "dailyMean_156",
    "value": 23.7,
    "baseline": 21.7,
    "delta": 2.0,
    "unit": "°C",
    "kind": "EARTHUS_ANALYSIS",
    "source": "기상청 ASOS 정시 관측의 하루 평균 − 기상청 1991–2020 평년 평균기온 (같은 지점)",
    "at": "2026-09-19",
    "stationId": "156",
    "method": "24회 정시 관측 평균",
    "samples": 24,
    "labelKo": "광주 어제 하루 평균",
    "labelEn": "Gwangju yesterday's daily mean"
   },
   {
    "key": "dailyMean_133",
    "value": 23.3,
    "baseline": 20.7,
    "delta": 2.6,
    "unit": "°C",
    "kind": "EARTHUS_ANALYSIS",
    "source": "기상청 ASOS 정시 관측의 하루 평균 − 기상청 1991–2020 평년 평균기온 (같은 지점)",
    "at": "2026-09-19",
    "stationId": "133",
    "method": "24회 정시 관측 평균",
    "samples": 24,
    "labelKo": "대전 어제 하루 평균",
    "labelEn": "Daejeon yesterday's daily mean"
   },
   {
    "key": "dailyMean_105",
    "value": 21.2,
    "baseline": 20.1,
    "delta": 1.1,
    "unit": "°C",
    "kind": "EARTHUS_ANALYSIS",
    "source": "기상청 ASOS 정시 관측의 하루 평균 − 기상청 1991–2020 평년 평균기온 (같은 지점)",
    "at": "2026-09-19",
    "stationId": "105",
    "method": "24회 정시 관측 평균",
    "samples": 24,
    "labelKo": "강릉 어제 하루 평균",
    "labelEn": "Gangneung yesterday's daily mean"
   },
   {
    "key": "dailyMean_184",
    "value": 24.6,
    "baseline": 23.0,
    "delta": 1.6,
    "unit": "°C",
    "kind": "EARTHUS_ANALYSIS",
    "source": "기상청 ASOS 정시 관측의 하루 평균 − 기상청 1991–2020 평년 평균기온 (같은 지점)",
    "at": "2026-09-19",
    "stationId": "184",
    "method": "24회 정시 관측 평균",
    "samples": 24,
    "labelKo": "제주 어제 하루 평균",
    "labelEn": "Jeju yesterday's daily mean"
   }
  ],
  "noteKo": "어제 하루 평균과 그날의 평년 평균을 뺐다 — 지금 기온과 하루 평균을 빼지 않는다(하루 온도 변화가 평년 차로 보인다)",
  "noteEn": "Yesterday's daily mean minus that date's normal — the current reading is not compared with a daily mean"
 },
 "sources": [
  {
   "id": "kma-asos-hourly",
   "kind": "OFFICIAL_OBSERVATION",
   "ageMin": 150,
   "slaMin": 120,
   "state": "aging"
  },
  {
   "id": "kma-normal-1991-2020",
   "kind": "OFFICIAL_OBSERVATION",
   "ageMin": 25929,
   "slaMin": 576000,
   "state": "fresh"
  }
 ],
 "coverage": {
  "missing": [
   {
    "section": "change",
    "reason": "이 문서는 한 시각의 실황만 담는다 — 시각 사이 변화는 변화 롤업(P2a) 배포 뒤에 채운다"
   },
   {
    "section": "pattern",
    "reason": "평년보다 더운 날이 며칠째 이어지는지 셀 이력 연결이 아직 없다"
   },
   {
    "section": "conditions",
    "reason": "같은 때·같은 자리의 조건(구름·바람·일사)을 이 패킷에 묶는 규칙이 아직 없다"
   },
   {
    "section": "related",
    "reason": "기온과 이어진 현상을 계산한 연결이 없다 — 교과서 관계도 아직 등재하지 않았다"
   },
   {
    "section": "next",
    "reason": "기상청 단기예보(kma-fcst)의 최고·최저 기온을 이 패킷에 옮기는 연결은 다음 단계다 — 우리 예보는 만들지 않는다"
   },
   {
    "section": "importance",
    "reason": "평년 차의 중요도 규칙이 정의되지 않았다 — 점수를 만들지 않는다"
   },
   {
    "section": "confidence",
    "reason": "정의된 산식(formula_id)이 없다 — 등급을 찍지 않는다"
   },
   {
    "section": "uncertainty",
    "reason": "관측 오차·평년 표준편차를 받지 않는다"
   }
  ]
 }
}